{
  "schemaVersion": 1,
  "package": {
    "kind": "extension",
    "name": "fixture-pkg",
    "version": "1.0.0",
    "installPath": "pkg-a"
  },
  "source": {
    "tarball": "fixture-pkg@1.0.0",
    "integrity": "sha512-AQ==",
    "shasum": "0000000000000000000000000000000000000000"
  },
  "scope": "测试用户可见文本。",
  "keepEnglish": "路径和内部标识保持英文。",
  "files": [
    {
      "path": "index.txt",
      "upstreamSha256": "5FDBAAF87E6229E01F519B8BE97D04D3A6989F1FE7B4FFA364C61C17A93D586F",
      "stringCount": 2
    },
    {
      "path": "keep.txt",
      "upstreamSha256": "F26B990B23EE2635EB192BE15A01F7AC8E54ABB8A58E76D2648B839D798C2CA4",
      "stringCount": 1
    }
  ]
}
