{
  "schemaVersion": 1,
  "package": {
    "kind": "extension",
    "name": "pi-mcp-adapter",
    "version": "2.26.1",
    "installPath": "npm/node_modules/pi-mcp-adapter"
  },
  "source": {
    "tarball": "pi-mcp-adapter@2.26.1",
    "integrity": "sha512-6/KDXIEPXTVM77274jAloxAo9AQSEy5EJ/7afIlUK2T8HOfeVapTJvwImvyChiIH+0gGShbFgnBK2BXFrjbj2w==",
    "shasum": "8c1a9259aaf18de05fdab71c10ae7c0fdb0d4ff6"
  },
  "scope": "CLI helper、扩展 CLI flag 说明、/mcp 与 /mcp-auth 用户界面、启动/页脚状态、MCP 主面板、setup 面板和 mcp-scripting 技能说明；MCP method、JSON-RPC/schema、工具名与工具描述、Slash command、selector、状态枚举、模型可见结果、外部路径、原始错误和技能名与正文保持英文。",
  "keepEnglish": "工具名、Slash command、命令参数、JSON/schema、selector、状态枚举、模型可见工具协议、系统 prompt、Provider/模型名、路径、URL、原始外部错误和技能名与正文。",
  "files": [
    {
      "path": "cli.js",
      "upstreamSha256": "0E6377CDE0A189EA5F21695B47BDE3302F7460E20EFAA9072E126A497AF4582B",
      "stringCount": 17
    },
    {
      "path": "index.ts",
      "upstreamSha256": "9A5DC0F657F3C272A3CFA079E33E6689FB37A6045E607EFA3EEC9A0C4EB32588",
      "stringCount": 17
    },
    {
      "path": "commands.ts",
      "upstreamSha256": "41F646C8BEFBF3E825431EE6608DFFCCE8DFFE937A86B6F96F5E15884894050F",
      "stringCount": 35
    },
    {
      "path": "init.ts",
      "upstreamSha256": "7FC4F5B19358E48237E7CC39985CBDA441DA38E291FEBF4AEB7968E8118155F0",
      "stringCount": 10
    },
    {
      "path": "mcp-panel.ts",
      "upstreamSha256": "5B17EE5030CA7729BA2795B4FE2073983B57DE3B12972C17A1076CCCBA887E7E",
      "stringCount": 42
    },
    {
      "path": "mcp-setup-panel.ts",
      "upstreamSha256": "0858A8EFE1D785F77CC15B3B4291F52B2F82029DCBD61BAE99709FB8131E4AFA",
      "stringCount": 35
    },
    {
      "path": "skills/mcp-scripting/SKILL.md",
      "upstreamSha256": "D33016AEB01D696E42FD57063E6447A3A25338EAE00176BFB8768149E2F29CD5",
      "stringCount": 1
    }
  ]
}
